{
  "operationId": "966",
  "languageCode": "0",
  "transactionCode": "2000405",
  "userId": "171052",
  "givexNumber" : "633701234528219529",
  "serialNumber" : "",
  "cardIso" : "",
  "historyType" : "",
  "startDate" : "12-12-2011",
  "endDate" : "12-12-2011",
  "transactionType" : "",
  "additionalData": "9121"
}